{"type": "order.drop_completed", "order_id": "ord_fixture_drop_completed", "campaign_id": "campaign_fixture_partner", "billed_count": 500, "actual_mailed": 480, "rts_suppressed_count": 20, "suppressed_count": 20, "completed_at": "2026-07-14T14:55:00+00:00", "event_id": "11111111-1111-4111-8111-111111111111", "event_type": "order.drop_completed", "timestamp": "2026-07-14T15:00:00+00:00"}